{
  "authority_hashes": [
    {
      "authority_id": "authority.user",
      "content_hash": "sha256:d3ce1562690ddf2dbe82809f308c0402b8176bb6646facd4a6c2e9f4c1fb4b37"
    }
  ],
  "baseline_id": "baseline.fixture",
  "captured_at": "2026-01-01T00:00:00Z",
  "content_hash": "sha256:1c32e01163427bd8c665f642c45b3988674ce8e430d30f08560eab4754a09278",
  "dirty_state": "untracked",
  "entries": [
    {
      "classification": "relevant",
      "content_hash": "sha256:4f1cf8d86a66caf554db9ac662dfe98a531cc614c2c4309a5e04c5f74912d3fd",
      "path": "src/output.txt"
    }
  ],
  "git_head": null,
  "git_state": "unborn",
  "repository_kind": "filesystem",
  "repository_root": "C:\\fixture-repository",
  "schema_version": "1.0.0",
  "scope": {
    "mode": "scoped",
    "protected_paths": [
      "AGENTS.md"
    ],
    "relevant_paths": [
      "src"
    ]
  }
}
